{
  "task_id": "ENG-142",
  "goal": "Correct failing deployment validation",
  "mode": "STRICT",
  "inputs_used": ["deployment workflow", "failing test output"],
  "artifacts_checked": ["existing workflow configuration"],
  "actions_taken": ["identified invalid environment mapping", "corrected mapping", "ran validation"],
  "findings": ["deployment validation failed because the environment mapping was inconsistent"],
  "evidence_refs": ["validation:test-run"],
  "validation": {
    "performed": true,
    "summary": "Targeted validation passed after the mapping change.",
    "result": "PASS"
  },
  "uncertainties": [],
  "unresolved_questions": [],
  "completion_state": "COMPLETE",
  "recommended_next_action": "Proceed through normal review."
}
